{
  "schema_version": "1.1",
  "run": {
    "id": "2026-08-31-spot-rerun-gemma4-e2b-g5g",
    "date": "2026-08-31",
    "operator": "xbill",
    "source": "sweep.py + make_report.py in gpu-pytorch-g5g-2b; run dir 2026-08-31-spot-rerun-g5g",
    "notes": "Third serve of gpu-pytorch-g5g-2b, and the first on the post-fix build (060a572aeb55: logits_to_keep=1 and device_map). Same AMI and instance shape as both prior runs, us-east-1a rather than us-east-1d because g5g spot capacity was exhausted in all four AZs for ~11 minutes. apt-daily/apt-daily-upgrade masked before the checkpoint download. 10/12 cells ok; the two 3800-context cells are infeasible, not failures - the prompt tokenises to 4630 against a 4096 --seq, exactly as in the 2026-08-29 profile-and-fixes run."
  },
  "hardware": {
    "accelerator": "NVIDIA T4G",
    "chips": 1,
    "topology": "single device",
    "hbm_gb_per_chip": 15.36,
    "machine_type": "g5g.2xlarge",
    "host": {
      "cpu": "AWS Graviton2 (aarch64)",
      "vcpus": 8,
      "ram_gb": 16
    },
    "pricing": {
      "rate_per_chip_hour": 0.4416,
      "currency": "USD",
      "source": "aws ec2 describe-spot-price-history, us-east-1a, spot, at run time"
    }
  },
  "model": {
    "id": "google/gemma-4-E2B-it",
    "family": "gemma-4",
    "parameters_b": 5.4,
    "weights_dtype": "float16",
    "quantization": "none (dense reference checkpoint)",
    "kv_cache_dtype": "float16",
    "max_model_len": 4096,
    "architecture_notes": "E2B: 28 sliding layers at head_dim 256 plus 7 full-attention layers at global_head_dim 512; 8 query heads to 1 KV head. transformers owns the cache here -- there is no hand-written ring and no padding."
  },
  "software": {
    "engine": "pytorch-transformers",
    "version": "torch 2.12.0+cu132",
    "backend": "cuda",
    "tensor_parallel_size": 1,
    "serve_args": [
      "--seq",
      "4096"
    ],
    "container_image": "AMI ami-07a66fa2acbcfea88"
  },
  "throughput": {
    "workload": {
      "tool": "sweep.py (this rig)",
      "dataset": "synthetic repeated filler, summarize instruction",
      "num_prompts": 1,
      "runs_per_point": 3
    },
    "sweep": [
      {
        "concurrency": 1,
        "input_len": 92,
        "output_len": 32,
        "status": "ok",
        "output_tokens_per_second": 10.669,
        "request_latency_s": 3.157
      },
      {
        "concurrency": 1,
        "input_len": 92,
        "output_len": 128,
        "status": "ok",
        "output_tokens_per_second": 10.685,
        "request_latency_s": 7.453
      },
      {
        "concurrency": 1,
        "input_len": 633,
        "output_len": 32,
        "status": "ok",
        "output_tokens_per_second": 11.327,
        "request_latency_s": 3.181
      },
      {
        "concurrency": 1,
        "input_len": 633,
        "output_len": 128,
        "status": "ok",
        "output_tokens_per_second": 10.995,
        "request_latency_s": 8.268
      },
      {
        "concurrency": 1,
        "input_len": 1259,
        "output_len": 32,
        "status": "ok",
        "output_tokens_per_second": 11.091,
        "request_latency_s": 3.571
      },
      {
        "concurrency": 1,
        "input_len": 1259,
        "output_len": 128,
        "status": "ok",
        "output_tokens_per_second": 11.048,
        "request_latency_s": 8.568
      },
      {
        "concurrency": 1,
        "input_len": 2501,
        "output_len": 32,
        "status": "ok",
        "output_tokens_per_second": 10.973,
        "request_latency_s": 4.361
      },
      {
        "concurrency": 1,
        "input_len": 2501,
        "output_len": 128,
        "status": "ok",
        "output_tokens_per_second": 11.169,
        "request_latency_s": 9.41
      },
      {
        "concurrency": 1,
        "input_len": 3746,
        "output_len": 32,
        "status": "ok",
        "output_tokens_per_second": 11.199,
        "request_latency_s": 5.332
      },
      {
        "concurrency": 1,
        "input_len": 3746,
        "output_len": 128,
        "status": "ok",
        "output_tokens_per_second": 10.946,
        "request_latency_s": 10.607
      },
      {
        "concurrency": 1,
        "input_len": 3800,
        "output_len": 32,
        "status": "infeasible",
        "error": "HTTP Error 400: Bad Request {\"detail\":\"prompt is 4630 tokens and the context bound is 4096, leaving no room to decode. Start the server with a larger --seq.\"}"
      },
      {
        "concurrency": 1,
        "input_len": 3800,
        "output_len": 128,
        "status": "infeasible",
        "error": "HTTP Error 400: Bad Request {\"detail\":\"prompt is 4630 tokens and the context bound is 4096, leaving no room to decode. Start the server with a larger --seq.\"}"
      }
    ]
  },
  "memory": {
    "usable_hbm_gib": 14.07,
    "weights_gib": 9.507,
    "notes": "Dense float16, no PLE quantisation and no int8 lm_head -- those are JAX-port levers with no analogue here. E2B KV is ~18 KiB/token, so at 4096 the whole cache is tens of MiB and is not the binding constraint."
  },
  "issues": [],
  "notes": [
    "Decode 10.67-11.33 tok/s across a 92-3746 token context range: flat, so decode is set by the weights rather than by the context.",
    "Quote the decode figures, not end-to-end: they come from tpu_jax_decode_tokens_per_second, which times decode alone. Both are in sweep.json and they do not agree.",
    "Degenerate replies over the whole run: 0."
  ]
}