{
  "schema_version": "1.1",
  "run": {
    "id": "2026-09-29-paired-sweep-1650ti",
    "date": "2026-09-29",
    "source": "local-llamacpp-1650ti-2b-q4_0",
    "notes": "PAIRED A/B, GPU ARM, ABBA. Context sweep at concurrency 1, 4 contexts x 2 output lengths, 3 repeats per pass, TWO passes per arm in ABBA order (CPU, GPU, GPU, CPU) so a linear thermal drift cancels between arms. Each pass started only after a >=120 s cooldown with the CPU package <=50 C and the GPU <=45 C. Figures are the mean of the two passes' per-cell medians; raw min/max span all 6 repeats. BOTH ARMS SERVE THE v2 EXACT Q4_0 GGUF (xbill9/gemma-4-E2B-it-qat-q4_0-exact-gguf, SHA-256 419db9a6, 2,620,370,912 B), the first paired run on it; every earlier paired run served Google's gemma-4-E2B_q4_0-it.gguf. Both arms: llama.cpp f95b0d9 (the same binaries as 2026-09-22, by sha256), identical flags except -ngl, -t 6 -tb 12 from both tpu.env files. Thinking ON for every request (the server default then; sweep.py now asks for it explicitly). Prompt cache verified defeated: 0 of 28,553 prompt tokens cached in every pass. Host: Lenovo Yoga 9 15IMH5, i7-10750H 6C/12T, GTX 1650 Ti Max-Q, one shared thermal envelope; package throttle events rose 50,918 in CPU pass 1, 3,209 in GPU pass 1, 4,932 in GPU pass 2 and 59,190 in CPU pass 2 - several times 2026-09-22's (9,604 / 420 / 2,879 / 19,279), with the package at 90 C at the end of both CPU passes. Page cache hot throughout. Arm attested from /proc on both passes: device=gpu, exe=/home/xbill/llama.cpp/build/bin/llama-server, sha256=9f2a8b0b6ed5365d, model /home/xbill/models/gemma-4-E2B-it-qat-q4_0-exact-v2/gemma-4-E2B-it-q4_0-exact.gguf. Not comparable to 2026-09-22 as a file comparison: the weights changed and the host ran much hotter; see the run's REPORT.md."
  },
  "hardware": {
    "accelerator": "NVIDIA GeForce GTX 1650 Ti with Max-Q Design",
    "chips": 1,
    "hbm_gb_per_chip": 4.294,
    "machine_type": "local workstation",
    "host": {
      "notes": "TU117, compute capability 7.5, NO tensor cores. Max-Q thermal envelope shared with the CPU package."
    }
  },
  "model": {
    "id": "xbill9/gemma-4-E2B-it-qat-q4_0-exact-gguf",
    "family": "gemma-4",
    "parameters_b": 4.63,
    "quantization": "q4_0",
    "kv_cache_dtype": "f16",
    "max_model_len": 8192,
    "architecture_notes": "Reasoning model: tokens arrive as reasoning_content until the thinking block closes; sweep.py counts both. v2 exact rebuild: every weight matrix is Q4_0 (both embeddings and per_layer_model_proj included), only 1.1 MB of F32 norms otherwise. per_layer_token_embd (1.32 GB, 50% of the file) is TENSOR_READ_LAZY."
  },
  "software": {
    "engine": "llama.cpp",
    "version": "b318-f95b0d9",
    "backend": "CUDA",
    "tensor_parallel_size": 1,
    "serve_args": [
      "-m",
      "/home/xbill/models/gemma-4-E2B-it-qat-q4_0-exact-v2/gemma-4-E2B-it-q4_0-exact.gguf",
      "--host",
      "127.0.0.1",
      "--port",
      "8080",
      "-ngl",
      "99",
      "-c",
      "8192",
      "-ctk",
      "f16",
      "-ctv",
      "f16",
      "-fa",
      "1",
      "-t",
      "6",
      "-tb",
      "12",
      "--parallel",
      "1",
      "--metrics"
    ]
  },
  "throughput": {
    "workload": {
      "tool": "sweep.py (byte-identical in both arms)",
      "input_len": 512,
      "output_len": 128,
      "runs_per_point": 6,
      "notes": "decode-source auto -> stream; llama-server emits no usage.decode_tokens_per_second, so decode is client-side inter-token latency off the SSE stream. Prompts are device-neutral and identical across arms. prompt_mode=unique (per-request nonce first, so the prefix cache cannot hit). 6 = 3 repeats x 2 ABBA passes."
    },
    "sweep": [
      {
        "concurrency": 1,
        "input_len": 94,
        "output_len": 32,
        "status": "ok",
        "output_tok_per_s": 44.538,
        "per_stream_tok_per_s": 79.421,
        "ttft_ms": {
          "median": 366.076,
          "p99": 366.581
        },
        "tpot_ms": {
          "median": 12.591
        },
        "raw": {
          "repeats": 6,
          "spread_pct": 0.45,
          "min": 79.217,
          "max": 79.573
        }
      },
      {
        "concurrency": 1,
        "input_len": 94,
        "output_len": 128,
        "status": "ok",
        "output_tok_per_s": 66.079,
        "per_stream_tok_per_s": 79.125,
        "ttft_ms": {
          "median": 369.385,
          "p99": 370.113
        },
        "tpot_ms": {
          "median": 12.6381
        },
        "raw": {
          "repeats": 6,
          "spread_pct": 0.27,
          "min": 79.034,
          "max": 79.248
        }
      },
      {
        "concurrency": 1,
        "input_len": 516,
        "output_len": 32,
        "status": "ok",
        "output_tok_per_s": 16.543,
        "per_stream_tok_per_s": 77.787,
        "ttft_ms": {
          "median": 1574.117,
          "p99": 1577.54
        },
        "tpot_ms": {
          "median": 12.8558
        },
        "raw": {
          "repeats": 6,
          "spread_pct": 0.87,
          "min": 77.46,
          "max": 78.135
        }
      },
      {
        "concurrency": 1,
        "input_len": 516,
        "output_len": 128,
        "status": "ok",
        "output_tok_per_s": 40.199,
        "per_stream_tok_per_s": 77.418,
        "ttft_ms": {
          "median": 1582.33,
          "p99": 1587.117
        },
        "tpot_ms": {
          "median": 12.9178
        },
        "raw": {
          "repeats": 6,
          "spread_pct": 2.18,
          "min": 76.436,
          "max": 78.124
        }
      },
      {
        "concurrency": 1,
        "input_len": 998,
        "output_len": 32,
        "status": "ok",
        "output_tok_per_s": 9.003,
        "per_stream_tok_per_s": 76.084,
        "ttft_ms": {
          "median": 3186.344,
          "p99": 3187.183
        },
        "tpot_ms": {
          "median": 13.1444
        },
        "raw": {
          "repeats": 6,
          "spread_pct": 1.87,
          "min": 75.389,
          "max": 76.813
        }
      },
      {
        "concurrency": 1,
        "input_len": 998,
        "output_len": 128,
        "status": "ok",
        "output_tok_per_s": 26.624,
        "per_stream_tok_per_s": 76.536,
        "ttft_ms": {
          "median": 3187.666,
          "p99": 3190.135
        },
        "tpot_ms": {
          "median": 13.0658
        },
        "raw": {
          "repeats": 6,
          "spread_pct": 1.21,
          "min": 75.951,
          "max": 76.874
        }
      },
      {
        "concurrency": 1,
        "input_len": 1959,
        "output_len": 32,
        "status": "ok",
        "output_tok_per_s": 4.722,
        "per_stream_tok_per_s": 75.446,
        "ttft_ms": {
          "median": 6403.556,
          "p99": 6419.705
        },
        "tpot_ms": {
          "median": 13.2547
        },
        "raw": {
          "repeats": 6,
          "spread_pct": 0.87,
          "min": 75.084,
          "max": 75.737
        }
      },
      {
        "concurrency": 1,
        "input_len": 1959,
        "output_len": 128,
        "status": "ok",
        "output_tok_per_s": 15.873,
        "per_stream_tok_per_s": 74.928,
        "ttft_ms": {
          "median": 6409.813,
          "p99": 6423.065
        },
        "tpot_ms": {
          "median": 13.3472
        },
        "raw": {
          "repeats": 6,
          "spread_pct": 1.85,
          "min": 74.228,
          "max": 75.611
        }
      }
    ]
  },
  "memory": {
    "usable_hbm_gib": 3.638,
    "weights_gib": 1.195,
    "kv_bytes_per_token": 18432,
    "notes": "MEASURED 2026-09-29 on this file from llama-server's allocation log with the serve flags: CUDA0 model 1223.91 MiB, KV 48 + 12 MiB (the 12 sliding layers capped at the 1024-cell window), compute 122.52 MiB; nvidia-smi 1480 MiB. kv_bytes_per_token is the geometry figure from MODELS.md and over-predicts llama.cpp's allocation."
  }
}